{
  "$schema": "http://json-schema.org/draft-07/schema#",
  "$id": "https://spec2code/schemas/project.spec.schema.json",
  "title": "Spec2Code project.spec",
  "description": "Canonical handoff artifact produced by the UI and consumed by the orchestrator (Brief 6.1).",
  "type": "object",
  "additionalProperties": false,
  "required": [
    "schema_version",
    "project",
    "controllers",
    "devices"
  ],
  "properties": {
    "schema_version": {
      "type": "string"
    },
    "project": {
      "type": "object",
      "additionalProperties": false,
      "required": [
        "name",
        "platform",
        "target_core",
        "runtime"
      ],
      "properties": {
        "name": {
          "type": "string",
          "minLength": 1,
          "pattern": "^[A-Za-z_][A-Za-z0-9_]*$"
        },
        "platform": {
          "type": "string",
          "enum": [
            "zynq_7000",
            "zynq_ultrascale",
            "versal",
            "microblaze_7series"
          ]
        },
        "target_core": {
          "type": "string",
          "minLength": 1
        },
        "runtime": {
          "type": "string",
          "enum": [
            "bare_metal",
            "freertos"
          ]
        },
        "output_mode": {
          "type": "string",
          "enum": [
            "dropin"
          ],
          "default": "dropin"
        },
        "testbench_transport": {
          "type": "string",
          "enum": [
            "auto",
            "eth",
            "uart",
            "coresight",
            "mdm"
          ],
          "default": "auto",
          "description": "Test bench agent transport: auto = eth varsa lwIP TCP, yoksa PS UART. coresight = JTAG DCC (psu_coresight_0, ZynqMP), mdm = MicroBlaze Debug Module UART (XUartLite, xsdb jtagterminal koprusu); ikisini de auto asla secmez."
        },
        "testbench_network": {
          "type": "object",
          "additionalProperties": false,
          "description": "Ethernet (lwIP) test bench ajaninin statik ag ayarlari; eksik alan varsayilanini alir (18.2.75.121/24, gw 18.2.75.1, MAC 00:0A:35:00:01:02, port 5000). DHCP yok.",
          "properties": {
            "ip": { "type": "string", "pattern": "^\\d{1,3}(\\.\\d{1,3}){3}$" },
            "netmask": { "type": "string", "pattern": "^\\d{1,3}(\\.\\d{1,3}){3}$" },
            "gateway": { "type": "string", "pattern": "^\\d{1,3}(\\.\\d{1,3}){3}$" },
            "mac": { "type": "string", "pattern": "^[0-9A-Fa-f]{2}([:-][0-9A-Fa-f]{2}){5}$" },
            "port": { "type": "integer", "minimum": 1, "maximum": 65535 }
          }
        },
        "bsp_flow": {
          "type": "string",
          "enum": [
            "classic",
            "sdt"
          ],
          "default": "classic",
          "description": "BSP akisi: classic = Vitis <= 2023.2 (xsct, XPAR_*_DEVICE_ID ile LookupConfig); sdt = Vitis Unified >= 2024.1 System Device Tree (DEVICE_ID yok, XPAR_*_BASEADDR ile LookupConfig, -DSDT, `vitis -s` Python workspace akisi)."
        }
      }
    },
    "coding_standard_ref": {
      "type": "string"
    },
    "llm": {
      "type": "object",
      "additionalProperties": true,
      "properties": {
        "enabled": {
          "type": "boolean",
          "default": false
        },
        "base_url": {
          "type": "string"
        },
        "model": {
          "type": "string"
        },
        "api_key": {
          "type": "string"
        },
        "timeout_s": {
          "type": "number",
          "minimum": 1,
          "default": 120
        },
        "max_tokens": {
          "type": "integer",
          "minimum": 128,
          "default": 4096
        },
        "max_response_chars": {
          "type": "integer",
          "minimum": 1024,
          "default": 120000
        },
        "retries": {
          "type": "integer",
          "minimum": 0,
          "maximum": 3,
          "default": 0
        }
      },
      "required": [
        "enabled"
      ]
    },
    "controllers": {
      "type": "array",
      "items": {
        "type": "object",
        "additionalProperties": false,
        "required": [
          "id",
          "type",
          "instance",
          "base_address",
          "source",
          "zone"
        ],
        "properties": {
          "id": {
            "type": "string",
            "minLength": 1
          },
          "type": {
            "type": "string",
            "enum": [
              "i2c",
              "spi",
              "qspi",
              "gpio",
              "uart",
              "dma",
              "can",
              "eth",
              "sdio",
              "unknown"
            ]
          },
          "instance": {
            "type": "string"
          },
          "base_address": {
            "type": "string",
            "pattern": "^0[xX][0-9a-fA-F]+$"
          },
          "device_id": {
            "type": [
              "string",
              "integer"
            ]
          },
          "driver": {
            "type": "string",
            "description": "Canonical Xilinx driver (e.g. XIicPs), used by codegen to pick the BSP API. Optional."
          },
          "subtype": {
            "type": "string",
            "enum": [
              "mdm"
            ],
            "description": "Ek/opsiyonel ayrim: driver ADI yetmediginde. mdm = MicroBlaze Debug Module UART'i (surucu yine XUartLite'tir, ama transport xsdb jtagterminal koprusudur). Diger her denetleyicide alan HIC bulunmaz."
          },
          "source": {
            "type": "string",
            "enum": [
              "xparameters",
              "manual"
            ]
          },
          "zone": {
            "type": "string",
            "enum": [
              "ps",
              "pl",
              "noc",
              "aie"
            ]
          }
        }
      }
    },
    "devices": {
      "type": "array",
      "items": {
        "type": "object",
        "additionalProperties": false,
        "required": [
          "id",
          "part",
          "attach"
        ],
        "properties": {
          "id": {
            "type": "string",
            "minLength": 1
          },
          "part": {
            "type": "string",
            "minLength": 1
          },
          "descriptor_ref": {
            "type": [
              "string",
              "null"
            ]
          },
          "simulate": {
            "type": "boolean",
            "description": "Sanal cihaz: kartta takili degil; test bench ajani ve CIT bu cihazi cit/ simulatoru uzerinden cevaplar (yalniz I2C register ve SPI TICS-register cihazlari)."
          },
          "config": {
            "type": "object",
            "additionalProperties": true,
            "description": "Board-specific device configuration consumed by optional device profiles."
          },
          "attach": {
            "type": "object",
            "description": "Connection metadata only (address/cs/mux/channel/gpio). Behaviour lives in the descriptor. Versioned + extensible (Brief 10).",
            "additionalProperties": true,
            "required": [
              "controller_id"
            ],
            "properties": {
              "controller_id": {
                "type": "string",
                "minLength": 1
              },
              "i2c_address": {
                "type": [
                  "string",
                  "null"
                ],
                "pattern": "^0[xX][0-9a-fA-F]+$"
              },
              "spi_chip_select": {
                "type": [
                  "integer",
                  "null"
                ],
                "minimum": 0
              },
              "address_width": {
                "type": [
                  "integer",
                  "null"
                ],
                "enum": [
                  8,
                  16,
                  24,
                  32,
                  null
                ]
              },
              "via_mux": {
                "type": [
                  "object",
                  "null"
                ],
                "additionalProperties": false,
                "required": [
                  "mux_id",
                  "channel"
                ],
                "properties": {
                  "mux_id": {
                    "type": "string",
                    "minLength": 1
                  },
                  "channel": {
                    "type": "integer",
                    "minimum": 0,
                    "maximum": 7
                  }
                }
              },
              "gpio_channel": {
                "type": [
                  "integer",
                  "null"
                ],
                "enum": [
                  1,
                  2,
                  null
                ],
                "description": "gpio transport: AXI GPIO channel the device's lines sit on (1 or 2). Default 1."
              },
              "gpio_pin_mask": {
                "type": [
                  "integer",
                  "string",
                  "null"
                ],
                "description": "gpio transport: 32-bit mask of the lines this device owns on that channel (integer or 0x hex string). Default all 32 pins."
              },
              "reset_gpio": {
                "type": [
                  "string",
                  "integer",
                  "null"
                ]
              },
              "irq_line": {
                "type": [
                  "string",
                  "integer",
                  "null"
                ]
              }
            }
          },
          "operations_requested": {
            "type": "array",
            "items": {
              "type": "string"
            }
          },
          "tests_requested": {
            "type": "array",
            "items": {
              "type": "string"
            }
          },
          "board_id": {
            "type": "string",
            "description": "Cihazin bulundugu kart; verilmezse ana kart."
          }
        }
      }
    },
    "muxes": {
      "type": "array",
      "items": {
        "type": "object",
        "additionalProperties": false,
        "required": [
          "id",
          "part",
          "controller_id",
          "i2c_address",
          "channels"
        ],
        "properties": {
          "id": {
            "type": "string",
            "minLength": 1
          },
          "part": {
            "type": "string",
            "minLength": 1
          },
          "controller_id": {
            "type": "string",
            "minLength": 1
          },
          "i2c_address": {
            "type": "string",
            "pattern": "^0[xX][0-9a-fA-F]+$"
          },
          "channels": {
            "type": "integer",
            "minimum": 1,
            "maximum": 8
          },
          "board_id": {
            "type": "string",
            "description": "Cihazin bulundugu kart; verilmezse ana kart."
          }
        }
      }
    },
    "boards": {
      "type": "array",
      "description": "Fiziksel kartlar. Verilmezse sistem tek ortuk ana karttan ibaret sayilir.",
      "items": {
        "type": "object",
        "additionalProperties": false,
        "required": [
          "id",
          "name",
          "role"
        ],
        "properties": {
          "id": {
            "type": "string",
            "pattern": "^[a-z][a-z0-9_]*$"
          },
          "name": {
            "type": "string",
            "minLength": 1
          },
          "role": {
            "type": "string",
            "enum": [
              "main",
              "peripheral"
            ]
          },
          "notes": {
            "type": "string"
          }
        }
      }
    },
    "connectors": {
      "type": "array",
      "description": "Kartlar arasi fiziksel baglanti (belgeleyicidir; elektriksel yolu degistirmez).",
      "items": {
        "type": "object",
        "additionalProperties": false,
        "required": [
          "id",
          "name",
          "from_board",
          "to_board",
          "bus"
        ],
        "properties": {
          "id": {
            "type": "string",
            "pattern": "^[a-z][a-z0-9_]*$"
          },
          "name": {
            "type": "string",
            "minLength": 1
          },
          "from_board": {
            "type": "string"
          },
          "to_board": {
            "type": "string"
          },
          "bus": {
            "type": "object",
            "additionalProperties": false,
            "required": [
              "controller_id"
            ],
            "properties": {
              "controller_id": {
                "type": "string"
              },
              "via_mux": {
                "type": "object",
                "additionalProperties": false,
                "required": [
                  "mux_id",
                  "channel"
                ],
                "properties": {
                  "mux_id": {
                    "type": "string"
                  },
                  "channel": {
                    "type": "integer",
                    "minimum": 0
                  }
                }
              }
            }
          },
          "notes": {
            "type": "string"
          }
        }
      }
    },
    "generation_options": {
      "type": "object",
      "additionalProperties": false,
      "properties": {
        "controller_register_maps": {
          "type": "boolean",
          "default": false,
          "description": "Eski anahtar (v0.1.238 ve oncesi), etkisiz: AXI IIC / AXI Quad SPI / AXI UARTLite PG register haritasi surucusu (drivers/ip/<id>_regs.h/.c) ve shell `ip_<id>` komutu artik her zaman uretilir."
        },
        "qc_max_rounds": {
          "type": "integer",
          "minimum": 1,
          "maximum": 10,
          "default": 3
        },
        "include_doxygen": {
          "type": "boolean",
          "default": false
        },
        "line_ending": {
          "type": "string",
          "enum": [
            "crlf"
          ],
          "default": "crlf"
        }
      }
    },
    "board_control": {
      "type": "object",
      "additionalProperties": false,
      "description": "Kart kontrol GPIO'su (dual-channel AXI GPIO: kanal 1 cikis, kanal 2 giris): AFE reset, JESD cekirdek fiziksel resetleri, GT PLL lock girisleri. drivers/ip/boardctl uretir; jesdlink ve AFE bring-up bunu kullanir.",
      "required": ["gpio_id", "bits"],
      "properties": {
        "gpio_id": {"type": "string", "description": "controllers[] icindeki AXI GPIO denetleyicisinin id'si"},
        "jesd_reset_ms": {"type": "integer", "minimum": 1, "maximum": 10000, "default": 100, "description": "JESD cekirdek fiziksel reset darbesi (ms)"},
        "bits": {
          "type": "array",
          "items": {
            "type": "object",
            "additionalProperties": false,
            "required": ["name", "channel", "bit", "role"],
            "properties": {
              "name": {"type": "string", "minLength": 1, "description": "sematikteki pin adi (uretilen kodda loglarda gorunur)"},
              "channel": {"type": "integer", "enum": [1, 2], "description": "1 = cikis kanali, 2 = giris kanali"},
              "bit": {"type": "integer", "minimum": 0, "maximum": 31},
              "role": {"type": "string", "enum": ["afe_reset", "jesd_rx_core_reset", "jesd_tx_core_reset", "pll_reset", "pll_lock", "sysref", "generic"], "description": "pll_reset: GT HSCLK/LCPLL reset pini, yalniz Versal'da (PHY reset calisma cevresi) JESD fiziksel reset darbesine katilir; diger platformlarda pasif tutulur"},
              "active_low": {"type": "boolean", "default": false, "description": "true: 0 seviyesi aktif (reset verildi / lock var)"},
              "target": {"type": "string", "description": "hedef: AFE cihaz id'si, JESD IP id'si ya da lock etiketi (bos = hepsi)"}
            }
          }
        }
      }
    },
    "custom_ips": {
      "type": "array",
      "description": "XSA'dan gelen taninmayan (custom) memory-mapped PL IP'ler; shell'e <id> dump|read|write komutlari uretir.",
      "items": {
        "type": "object",
        "additionalProperties": false,
        "required": [
          "id",
          "base_address",
          "register_count"
        ],
        "properties": {
          "id": {
            "type": "string",
            "minLength": 1,
            "pattern": "^[a-z_][a-z0-9_]*$"
          },
          "instance": {
            "type": "string"
          },
          "ip_name": {
            "type": "string"
          },
          "base_address": {
            "type": "string",
            "pattern": "^0[xX][0-9a-fA-F]+$"
          },
          "high_address": {
            "type": "string",
            "pattern": "^0[xX][0-9a-fA-F]+$"
          },
          "register_count": {
            "type": "integer",
            "minimum": 1,
            "maximum": 1048576,
            "description": "4 baytlik register sayisi (ADDR_WIDTH ya da HIGH-BASE+1 / 4)."
          },
          "register_map": {
            "type": "string",
            "enum": [
              "jesd204c",
              "regmap_test"
            ],
            "description": "Register haritasi bilinen IP (PG belgesinden): drivers/ip/<id>_regs.h/.c + shell ip_<id> ve Register Map ekrani otomatik uretilir."
          },
          "ip_parameters": {
            "type": "object",
            "additionalProperties": true,
            "description": "Bilinen IP parametreleri (jesd204c: lanes 1..8, direction rx|tx, link_layer 64b66b|8b10b, subclass 0..2); XSA'dan gelir, elle ezilebilir."
          }
        }
      }
    }
  }
}
